{
  "title": "Billede og tekst",
  "icon": "",
  "description": "Mulighed for at s√¶tte billede og tekst, med forskellige visninger.",
  "resources": {
    "component": "https://raw.githubusercontent.com/os2display/display-templates/develop/build/image-text.js",
    "admin": "https://raw.githubusercontent.com/os2display/display-templates/develop/src/image-text/admin.json",
    "schema": "https://raw.githubusercontent.com/os2display/display-templates/develop/src/image-text/schema.json"
  }
}
