{
  "title": "Anmeldelse",
  "icon": "",
  "description": "Skabelon til anmeldelser.",
  "resources": {
    "component": "https://raw.githubusercontent.com/os2display/display-templates/develop/build/book-review.js",
    "admin": "https://raw.githubusercontent.com/os2display/display-templates/develop/src/book-reviewt/admin.json",
    "schema": "https://raw.githubusercontent.com/os2display/display-templates/develop/src/book-review/schema.json"
  }
}
